sentence	label
무각본으로 이루어진 리얼한 연기, 한장면도 빼놓을 수 없는 예쁜 영상미.	영상미
다시 이 조합 보고싶당! ㅋㅋㅋ 영상미 짱	영상미
뛰어난 각본 및 구성. 흑백의 영상미. Le monde est a nous	영상미
잔잔하지만, 영상미도 좋고 감동도 있다. 다시보고 싶네.	영상미
영상미는 있는데 아빠와 딸의 사이같은 남주와 여주 때문에 소름돋았다.. 감독이 우디앨런이라 그런가 ㄷㄷㄷ	영상미
지인의 추천으로 본 영화입니다. 영상미도 음악도, 스토리도 탄탄하니 좋았습니다. 오랫동안 기억에 남을 영화.	영상미
짧은 러닝타임.. 짧아서 더 여운이남고 영상미와 음악까지 모두 굳..	영상미
어린이용 만화 감안 내용 너무 유치하고 재미없고 영상미도 별로다	영상미
그림 영상미 bgm 모든게 좋았던! 작업하는 모습이 정말 푹 빠져들게 했어요	영상미
진부하지 않은 러브스토리. 영상미도 좋고 음악도 좋고 전반적으로 특색있는 영화입니다.	영상미
영상미, 음악은 정말 괜찮아요. 이거 하나로 볼 만한 영화임. 말도 안되는 어른 여자의 판타지 소설이지만;	영상미
러닝타임내내 미술관에 온 것같았고 내가 마치 숲속안 르누아르의 집 안에 함께 하는 것 같다고 생각할 만큼 집중도 높은 영화였다.영상미 자체는 이루 말할 데 없이 훌륭하였고 잔잔한 분위기로 숨죽여 볼 수 있게 만든 구성도 완벽했다	영상미
영상미가 아주 멋진 영화. 스토리는 그냥 그랬지만 영상미가 압도적이었기에 만점드립니다.	영상미
뛰어난 영상미. 기발한 상상력. 보고난 후엔 숨통을 밧줄로 옭아맨 기분. 슬프다...	영상미
일본영화 특유의 잔잔함..빠져들고 싶은 영상미 마음에 평안이 온다	영상미
정말 영상미넘치고 잔잔하고 아름다운영화 간만에 좋은영화봤네요ㅠㅠ	영상미
영상미와 아름다운 사운드트랙. 풍부한 감수성과 시적 아름다움. 터부에의 도전.	영상미
음악이 주가 된, 최고의 음악영화	영화음악
마음이1을보신분들은 이해하시겟지만 2는망장입니다 졸작이죠 솔직히말해선;; 그이유는 예를들면 엽기적인그녀는 긴시간을두고 코메디 멜로를 그렷습니다 하지만 이영화는 단시간 10분안에 모든것을 소화하려는 욕심 코믹하다 3분채안돼갑자기 생뚱맞게 슬픈음악이깔리고	영화음악
실제 사실은 어땠는지 모르겠으나 의로운 협객으로서 김두한이 거지패에서 종로 최고의 주먹으로 평정하는 초기 모습을 잘 보여 줌. 배경음악이 영상과 잘 어울린다는 느낌. 참고로 황정민이 우미관 지배인으로 나와서 유명하기도 한 영화.	영화음악
정말 가슴아픈영화....질리지도 않는영화....몇번을봐도...음악도 너무 좋아요...OST도 구해 들었다는...	영화음악
재미있습니다...ㅋ 좀 황당하고 유머러스하고 엉뚱하지만 유쾌하게 보았네요~ 더불어 음악도 좋았습니다~^^	영화음악
수채화같은 영상과 가슴을 울리는 음악이 조화된 잊지못할 명작	영화음악
잔잔한 음악과 후반부에서 큰 재미를 드러내는 영화. 좋다^^	영화음악
음악 쌤이 보여줬는데 진짜 짱인 영화	영화음악
두 부자가 겪는 사랑의 조심스런 시작에 관한 마이크 밀스 감독의 섬세한 터치. 주인공들과 강아지 아서까지 모든 캐릭터와 음악과 삽화들과 교차편집까지 이토록 예쁘고 사랑스러울 수 있을까. 다운받아 수시로 틀어본다.	영화음악
흑인음악이 왜 soul인지 알수있을거같다..	영화음악
이제서야 보게되었네요.늦은밤 미소와 안타까움에 마음이 찌릿했습니다.사랑이란 감정은 하나로 정의되는것이 아니며늘 다른 모습으로 곁에 있는 것 같습니다.한가지 아쉬운점은 슬픈장면에서 나오는 음악이 너무 반복되네요ㅋ몰입 약간 방해. .	영화음악
소재만 신비롭지...영상, 내용 그리고 배경음악 등이 왜이리도 촌스럽고 허접하게만 보이고 느껴지던지...	영화음악
좋았어요연기, 음악 모두... 춤도 볼만하고보아 연기도 괜찮았어요	영화음악
음악, 영상은 좋지만- 여주인공의 성격과 스토리의 개연성 부족. 기독교인에게는 추천	영화음악
스텝업1을 많이 따라한감이 있지만 좋은 음악과 춤 좋은 헤피엔딩이다.	영화음악
밥대런 그의 음악에 울고 그의 일생에 울었다. 아... 이게 실화라니...	영화음악
자연환경, 배경음악, 영상미의 극치를 보여주는 너무나 아름다운 무협영화.	영화음악
여태껏본백설공주이야기중가장현실적이고슬펐다스페인특유의분위기와스토리가음악으로잘표현되어서눈과귀가즐거웠다	영화음악
매력적인 배우들과 매력적인 음악. 아 아름답지.	영화음악
음악에 무지한 내가 봐도 감동적인 영화임 ㅠㅠ	영화음악
뒤로 갈수록 개판, 추억의 록음악땜에 별두개	영화음악
갇동과 웃음이 있네요 음악도 좋았구요 로빈 너무 귀여워요 ^^	영화음악
아이들이 보기에 너무 좋은 컨텐츠인것 같아요. 캐릭터와 드라마, 중간중간 지루하지 않게 음악까지~ 화면에서 관객에게 물어보는데 깜짝놀랐어요 ㅎㅋㅋ	영화음악
추억의 영화 마지막 엔딩장면에 나오는 음악 인상깊다	영화음악
파가니니의 일생을 제대로 전달하지도 못했고, 현대식으로 편곡된 저렴한 가렛식 파가니니곡들도 듣기 꺼림칙했다.강한 나르시즘에 빠진 연예인님 데이빗이 자기연출하려고 찍은 영화.음악을 빌미로 자기 광고하려고 찍은것같다. 빠르게 연주한다고 천재? 아니다.	영화음악
톱줄을 튕기는 듯한... 독창적인 모리꼬네의 음악은 압권이다.	영화음악
춤, 음악에 공감을 못하니 남는 것은 없다.	영화음악
음악 미술품...	영화음악
이건 그냥 음악으로 감성팔이 하는 싸구려 로맨스 영화..	영화음악
고증거친 화면과 배경음악, 탄탄한 시나리오로..	영화음악
No Diggity 부를때 오줌쌌다 그부분만 10번을 돌려봤다..음악 좋아하는사람은 무조건봐라!!!!	영화음악
음악도 좋고, 내용도 좋았습니다.	영화음악
다 알바야 뭐야?? 난 지루하고 음악도 생각보다별로라서 중간에 나왔는데	영화음악
음악과 인간과 그 시대상이 모두 적절히 어우러진 감동적인 영화였어요 :)	영화음악
오랜만에 본 음악영화라 좋았다:)	영화음악
감동적이고 음악짱좋음	영화음악
상상력이 기발한 독특한 호러무비. 크리스토퍼영의 음악도 좋고 87년도 영화인데 지금봐도 이만한 호러무비 없을 듯.	영화음악
HOT 한 천재음악가에 대한 제대로된 판타지를 갖게 하는!	영화음악
편한이야기,좋은음식,좋은음악 무엇이 더필요하리?	영화음악
음악은 최고 시작부터 끝까지 흥얼거렸다. 영화가 끝난 이후로도 흥얼거리게 된다. 그런데 두 남자 사이에서 일로나의 행동은 공감되지 않는다. 그냥 어장관리로밖에 안보여진다.	영화음악
중간중간에 나오는 bgm 맘에들음 ㅋ 성치형 차도에 차버리고 갈때가 간지	영화음악
어이없어 합채 정도 애들 넘치고넘치는 아이돌되고싶은애들아님? 썸띵이 왜 탈락이지? 완전어이없는 심사 ㅋㅋ 양현석 박진영이 합채밀어붙였겠지 심사의원 한명더 모셔와라 불공정심사다 시청자들기만하냐? 아무리 니들이 음악을 전문가라도 이건 진짜 아니다 ㅡㅡ	영화음악
흑인 특유의 신나는 음악이 너치는 영화..이제시대의 우리와 닮은..	영화음악
맨날 에스카플로네 등장할때 오케스트라음악나오면 감동먹었음	영화음악
몽환적음악	영화음악
배경,음악,, 헬레나의 여리한 얼굴이 좋다. 감성충만영화	영화음악
음악과 예술을 사랑하는, 그리고 '사랑'을 아는 사람들의 이야기...	영화음악
음악이랑 작화, 몰입감 최고!	영화음악
훌륭한 연기와 음악까지~~ 이건 정말 두번 봐도 될 영화다~~	영화음악
맷 데이먼의 절재된 연기가 완벽하다.실존 인물을 바탕으로 만들었기에 현실감을 더 해주기도 한다.영화의 러닝타임이 매우 길지만 그 만큼 빠져들게 한다.굿 셰퍼드 특유의 분위기와 음악은 너무나도 매력적.	영화음악
이것은 음악 다큐, 영화의 신경지	영화음악
빌보드에 나온 것도 아니고 왜 갔느냐고들 하더라.. 하지만 우린 음악이 아니라 인생을 느끼러 갔던거야.	영화음악
1점도 아까운 영화 원작을 크게 훼손시킨 쓰레기영화스토리도 완전 다르고 중국어때문에 집중이안되서 몰입또한 안되고 영화음악은 느려터지고원작생각하지 말고 볼려면 보고아니면 보지마세요 기분만더러워짐	영화음악
사실 관람 전에 별 다른 기대를 하지 않았었다. 관람 후에는 기대를 하지 않았던 점이 무척 다행이라고 생각했다. 추가: Rachmaninoff Piano Concerto No. 3 . 의 음악에서 Shine 이라는 영화를 떠오릴 것은 큰 수확	영화음악
아름다운 음악 한곡을 들은듯 풍부하게 남는 여운	영화음악
시간가는줄모르고봤다 지루하지도않고 음악도좋았다 연기너무잘해서 후반에 모차르트에게 고통과 슬픔이보여서 더 안타까웠다 몇번이고다시볼영화!!	영화음악
음악 영화라고 하기도 좀 그렇고 성장 영화라고 하기도 좀 그렇다. 어정쩡하고 어정쩡한 영화.	영화음악
ㅋㅋㅎㅎ음악이랑 완전웃긴다	영화음악
톤즈를 위해 의사가 되시고, 선생님이 되시고, 음악가가 되신 이태석 신부님. 존경합니다.	영화음악
처음엔 배우에 빠졌고 나중엔 영상과 음악에 빠져버렸다!좋아~♥	영화음악
어색한 연기의 극치 하지만 사운드 음악들은 굿	영화음악
가족끼리 볼 수 있는 케릭터가 너무 귀여운 재밌는 영화예요. 특히 음악 좋아하는 분들 강력히 추천해요. ^^	영화음악
ㄴㄴ 음악은 멋있는데 할머니들 너무 시름 그냥...	영화음악
스토리 굿 연기 굿 음악 굿 대형마트가지말고 동네 가게 이용해 주는거야 그게 너도 나도 잘사는 길	영화음악
일단 스토리가 고전동화의 원작에 충실합니다. 색감도 장면마다 미술작품처럼 정말 아름답구요. 어울어지는 음악도 훌륭하고 더빙도 영화에 몰입을 방해하지 않는 최선의 캐스팅이네요. 장인들이 공들여 고급스럽게 만들어낸 품격있는 명작입니다. 강추합니다~!!^^	영화음악
보는 내내 잔잔한 미소가 지어지는 영화. 거기다 음악도 좋고	영화음악
시즌3의 실패는 카리스마 음악의 진실의 깊이를 모두 갖은 김기련	영화음악
중학교때 낡은 비디오방에서 이 영화를 처음보구 장국영이란 남자를 미친듯이 사랑하게 되버리고 세상에 태어나 처음으로 내돈주고 음악테잎이란걸 사서들었다...아직도 그의 목소리가 귀에 아른거린다...	영화음악
1970년대에 사회적분위기땜에 명작된 영화 허나지금은 영화음악으로 더유명함	영화음악
내가 대학을 다녔던 90년대에 상영했던 영화를 그때는 영화음악이 참좋다고만 생각했는데 20년이 흐른뒤 네이버 영화보기로 보니 감동적이었다.	영화음악
영상과 음악이 어우러진 한편의 로망(Roman).	영화음악
음악영화!! 원스 어거스트러쉬 말할수없는비밀 그이상이다!!	영화음악
영화 시작부에 음악이 좋았던 기억이...	영화음악
최고의 영화입니다. 스토리, 배경, 음악, 메시지 모두 훌륭하네요	영화음악
실감하는 레고!!배경 음악도 재미있고...	영화음악
음악 영상 전개 다 좋다...잘 만든 공포영화!!	영화음악
주옥같은 콜 포터의 음악과 카메오 가수들을 보는 재미가 쏠쏠	영화음악
케냐의 그림같은 경치와 음악의 조화가 환상적인 영화입니다!	영화음악
bgm, 파리의 풍경 자체가 예술 !	영화음악
오래전에 봤지만...아바의 음악들이 너무 맘에 들었고...정말 어울렸다~	영화음악
음악도 별로고,아이들은 별로웃지않고,진짜재미없고,더빙은 괜찮았어요	영화음악
내가 음악과 영화를 좋아하는 이유를 느껴주게 한 영화	영화음악
mate의 음악은.. 정말.. 최고다. 영화로 만나니 더 새롭네	영화음악
다시 보고 싶습니다. 이렇게 오래된건지 몰랐네요. 주인공도 너무 멋지고, 음악도 좋고 ㅎㅎㅎ 갑자기 추억 돋네	영화음악
그냥 멜로 영화라고 하기엔 심도있는 영화. 음악도 좋고 수지라는 여자 참 매력있다. 미쉘파이퍼 노래실력! ost로 듣고 싶네	영화음악
음악만 예술	영화음악
어제내린비. 나의 어린 시절에 본 그 영화의 음악에 매료되었다	영화음악
관객과의 소통을 버린 영화. 연출, 흐름, 배경음악 모두 최악 스토리는 말할 것도 없고.. 과제인가요? 졸업작품인줄 알았습니다. 한국애니메이션을 사랑하는 사람으로써 굉장히 실망했습니다. 보는내내 관객을 너무 불편하게 했던 영화.	영화음악
배우들의 연기,호흡,몰입도,연출,음악 정말 환상의 오케스트라였다.	영화음악
호러무비 보다 4배속으루 돌려보긴 첨. 귀신들만큼 영화 진행속도 엄청 느리구 느려서 짱나는데 음악두 짜증남. 킬링타임으로두 부족한. 이건 b,c 급에두 못들어가는 영화. 영화 댓글 달아본적 엄는데 방금 보구 짜증나서 남긴. 절대 비추!	영화음악
우와 이런영화도있구나 연기력0.1 스토리0.2 음악ㅇ 합이 0.3 진짜 발연기는그렇다치고 중간중간나오는 60년대 통기타소리는 정말이지 최악이다	영화음악
정말 명작 히사이시조의 음악때문에 더 명작!!	영화음악
음악에 취했는지 영상에 취했는지 정말 마법에 걸린건지..	영화음악
배우들 연출 스토리 배경음악 모두 다 굉장한 수작이네요 한국에 이런 드라마가 나올수 있다니 정말 감동이예요	영화음악
잔잔한 음악영화 좋아하는 나에게도 밋밋한 영화.어바웃타임 > 비긴어게인 >> 블랙버드>> 송원	영화음악
중반에 좀 지루한 감은 있었지만, 환상적이었던 음악과 멋졌던 스토리 라인.	영화음악
음악 케릭터 분위기...대박영화...	영화음악
흑인의 현실에서 반영되는 음악이 뭔지 제대로 알고 싶다면.이게 바로 그럴 수 있는 영화.	영화음악
감동적!! 가끔씩 음악을 들었을 애 아들의 반응으로 피식 웃음이 나오는 영화였어요.	영화음악
나도 정말 동물좋아하는데 영화의 평은 별개다. 감독이 많은걸 시도한것같지만 결국 이도저도아닌ㄴ게 되버렷다. 전체적인 영화의 흐름도 그렇지만 개개의 이야기들도 별로엿다. 마지막장면에서 눈물흘린사람들이잇을것같은데 슬픈음악에 감동적글몇개 띄운다고해서 좋은영	영화음악
영화음악과 함께 진한 여운이..	영화음악
음악과 함께 전해져오는 메시지 !!	영화음악
음악 ㅈ나 쓰레기, 빰빰빠빠빱빠	영화음악
영화보는 내내 귀가 즐거운 기분이네요~한동안 잊고 살았던 음악에 대한 나의 욕망을 채우는 기분이라 정말 좋게 보고 나왔습니다!	영화음악
70년대 영화 보는 느낌...음악이랑 영상 기가 막히게 맞아 떨어지는데 겁나 웃김ㅋㅋ코미디 영화로 보시면 재밌게 보실수 있습니다	영화음악
음악이랑 빛나는 미모 외에는 볼 게 없음.... 아름다운 사랑이라는 건 누가 정의함? 내게는 아름답지 않았음	영화음악
음악 굿... 남배우 목소리 굿... b	영화음악
혼자 비디오로 보면서 감동했던 기억이.. 음악도 좋고..	영화음악
정말 감동적인 영화이구 음악의 효과를 받아서 더 멋진영화가 아니였나 싶습니다.	영화음악
음악은 정말 완벽했지만 선생들의 연기가 너무 너무 별로였다.ㅜ	영화음악
나도 학창시절 음악선생님이 떠오른다..	영화음악
내가 본 한국 드라마사상 최고의 수작. 작가의 필력, 감독의 연출력, 음악감독의 배경음악, 카메라워크, 배우들의 빼어난 연기력...모두 10점 만점에 10점. 최고.	영화음악
그 남자의 삶. 예술적영감 헨델의 음악까지...굿	영화음악
리브 타일러의 10대 후반, 샤를리즈 테론 20대 초반 때 리즈 시절 모습과 환상적인 영화음악. 한 마디로 대박 !!!	영화음악
처음에는 초롱 팬심으로 봤는데 갈수록 내용과 어울리는 배경음악들이 너무 달달하고 보고 있으면 행복해지네요. 완전 재밌습니다.	영화음악
1편이랑 너무 비교되서 왜봤는지 눈물이 다 났다. 마지막에가선 웃음만나왔음.어이없어서. 차라리 다른 영화나 볼껄..음악은 괜찮음.극연출도 괜찮았음. 내용은 아침막장드라마. 배우들도 실망스러움.	영화음악
음악영상 굿.	영화음악
유키 구라모토 음악을 듣는게 낫겠다.	영화음악
몽환적인 영상과 음악. 너무나 예쁜 이나영에 통통튀는 파란색까지!	영화음악
병운이가 희수 신발끈 묶어주면서 상처받았던 얘기하는 장면도 좋고, 둘이 돈받으러 돌아다니면서 등장하는 서울 곳곳을 보는 것도 좋고, 음악도 좋고 무엇보다 마지막 장면이 참 좋습니다	영화음악
나에겐 별로였음 . 음악이 몰입을 방해하고 스토리도 엉성하고	영화음악
좋았어요 영화이야기도 좋고 풍경도이국적이고 카고시티음악...계속 검색중 국내에는 별로 알려지지않았나...	영화음악
이것은 음악만 느낄께 아니라 스토리를 느껴야한다. 아름다운 우정... 이게 음악와 조화를 이룬것이다.	영화음악
영화만나오면모하나요 음악도갖이소개시켜주세요	영화음악
시사회보고 왔었는데요 강추합니다 화면도 음악도 좋았어요 또 보려고요 시네토크로 예매했답니다^*	영화음악
음악과 계속되는 전쟁씬 62년도를 생각하면 더욱 재미있다	영화음악
리들리 스콧의 영상미학과 한스 짐머의 음악... 후까란 바로 이런 것이다.	영화음악
지금껏 봐온 많은 영화 중에서 O.S.T가이렇게나 좋았던 영화는 처음입니다! 주인공들의 이야기 하나하나가 노래로 잘 표현된 영화입니다! 이런 영화를 140자로 표현해야 하는게 아쉬울 정도네요ㅠ 음악을 좋아하시는 분들께 정말 추천해드리고 싶습니다~!^^	영화음악
정신병자가 영화만들었나? 자길 버린 아버지에 대한 애증어린 복수 이게 넘과하게 그려진거같음. 캐릭터하며 영상하며 음악하며 하나부터 열까지 정말 감독스타일이 넘싫다.	영화음악
대회에 참가해서도 경쟁하기보다는 진심으로 음악을 즐기는 지휘자들의 모습이 감동적이었습니다.	영화음악
재미는 없지만 독특한 매력이 있는 영화가장 기억에 남는 건 남여주인공이 서로 만난 순간 나눈 스킨쉽 장면 이었다. 음악과 달듯 말듯한 그들의 몸짓과 손짓이 신비로웠다. 무섭고 슬픈영화였다..	영화음악
휴~~~앞스토리도 그렇구 똑같잖어.한놈은 싫다구 내빼구 한놈은 좋다구 들러붙구 ㅋ 음악들은 하나같이 왜그런지. 게이들 취향인가? 경례 휴~~~ 허접한 게이영화.	영화음악
평범식상한 스토리에 귀를 괴롭게 하는 촌스러운 음악	영화음악
007 중 음악은 이 영화가 최고, 전체적으로는 뷰 투 어 킬이 최고다	영화음악
타계하신 배우,윤인자 님께서 주연으로 열연을 보여주신 당시 우리 영화로는 보기드문 수작이라고 기억합니다.오래전, 극장에서 본 영화라서 기억은 가물 대지만 ,전편에 잔잔하게 흐르는 음악도 좋았었구요...윤인자 님의호연이 참,좋았다고 생각합니다.	영화음악
위트와 음악이 녹아든 영화. 똑똑한 천재가 아나라 주체적인 천재에 감화된다	영화음악
기대 안하고 봤는데 좋네요. 음악하는 사람에게는 강추	영화음악
중간중간 음악 선곡들이 제일 웃김. 웃기라고 한 선곡은 아니겠지만... 참재미없다...	영화음악
굳 음악도 좋고 영화가 주는 교훈도 있고 it's cool	영화음악
종교, 인종, 음악에 대한 색안경 없이 최대한 객관적으로 관람하려고 노력했습니다. 결론은 최악입니다. 다큐도 잘만들면 재미있다라는 생각에 봤는데 뭐 이런 망작이 다있나요. 평점 절대 믿지마세요. 감동과 힐링? 웃음만 나오네요	영화음악
천재음악가 베토벤의 일생에서 사랑이라는 일면을 부각해서 스토리를 입히고 재해석한 작품. 틈틈이 나오는 베토벤의 음악과 베토벤의 삶이 어우러져 보는 내내 가슴을 울립니다. 주연 배우의 흡입력 있는 연기가 일품입니다.	영화음악
일본이 만든 영화보다는 천군이 더낮다.거기다 천군 OST 음악도 좋다.	영화음악
한국영화중에 몇번을봐도 질리지않는건 이영화뿐오늘 다시보니 배우연기영상 다 좋지만 음악선곡이 최고음향감독님이 뉘신지 너무 매력적입니다	영화음악
역대최악의 리메이크를 싸지른 감독의 이름이 다름 아닌 팀 버튼. 스텝들이 불쌍해서 별 한 개라도 준다. 줄거리, 연출, 연기, 영상... 엉망이 아닌 건 대니 엘프먼의 음악과 에스텔라 워렌의 몸매 정도? 안타까움을 넘어 기가 찬다.	영화음악
썩 재밌진 않으나 제프 벡과 데이빗 커버데일이 음악에 참여해서	영화음악
담백하고 투박한 음악 영화	영화음악
모든 장면이 명장면, 배경음악도 감동적. 상큼한 대사가 너무 좋아.	영화음악
재밌네용~~ 야하기만하고 내용은별거없는허접한영화도많은데 내용도탄탄하고 몰입해서잘봤어요 다른부분도다훌륭하지만 연기력 음악 영상미 굿굿	영화음악
좋은 음악...아름다운 영화다	영화음악
이따위영화가 8점이상이라니...ㅋㅋㅋ...할말이없음..나도 참 다양한영화를 보는데 보다가 중단한 영화는 처음이다..아무리 재미없어도 10초씩 빨리감기로 다 봤는데..음악은 또 시도때도없이 계속나와서 몰입도 안되고....4-5점 정도가 적당	영화음악
이젠 이런게 영화로도 나오네 ㅋㅋㅋ 대한민국 음악계, 영화계 망했네 ㅋㅋ 다상업적인겄만 나오고	영화음악
음악이 정말 마음에들고 권격영화중 본영화중 거의 최고입니다~!!!	영화음악
음악이 가득한 영쿡영화라면 필수감상목록	영화음악
자극적으로 표현할수 있다면.. 오로지 음악으로써 나에게 오르가즘을 느낄수있다고 해줬달까~~~?	영화음악
최고의 오케스트라 공연을 상영하는 건 좋지만 2013년 베를린필 송년음악회를 신년음악회로 바꾸고, Live 중계라고 홍보하면서 4만원이나 받는 건 좀 아닌 거 같다...	영화음악
골드핑거라는 제목과,007 명성에 비해서는 2프로 부족한 느낌이네요..주제가음악,멋진 스위스풍경..그리고,한국인 악당 모자날리기가 골드핑거를 살렸다고 봐요 ㅋㅋ 보릿고개 시절..선진국 영화 보는 느낌이란?	영화음악
아직도 기억이생생한 백영규님의음악 다시한번 감상하고싶네여!	영화음악
명작 색감의 활용과 중국 특유 느낌의 음악 다 훌륭하다	영화음악
마지막 4중주도 아주 볼만한 클래식 음악 영화이기도 하겠지	영화음악
감독이 째즈가수가 아니였다면 이런 영화는 만들 수 없었을 것이다. 멋진 음악다큐!	영화음악
인디음악 분위기에 맞춰 억지로 짜낸 스토리는 현실괴리적이기만 하다. 상류층 십대의 환각과 환상 ? 젊은시절에 파업전야를 만든 사람이 현실감각을 잃고 이유 있는 투쟁에서 이유없는 반항과 개인주의로 스스로의 역사성을 단절시킨 졸작이다.	영화음악
좋아하는 배우들이 나오고, 배경음악은 좋아하는 노영심님이 한. 너무 좋은 드라마. ^^ 그런데. 이 드라마 보고. 헤어진 사람에 마음 헛갈리는 분은 없기를 T T 드라마랑 현실은 다르니까요	영화음악
음악을 못느끼셨다면 영화의 20%만 보신겁니다.	영화음악
시사회로 봤는데요. 1편보다 스토리는 너무 막장이고, 음악도 너무 강하게 지르고 휘몰아치네요. 화려한 볼거리를 제외하고는... 실망이 크네요	영화음악
음악을 들으면서 눈물을 흘릴 수 있다는 것을 가르쳐준 비틀즈의 영화 정말 감동임!	영화음악
